comm_name,short,members_count,about_comm
SHARE Breast Cancer Support,Breast cancer,2468.0,"SHARE Breast Cancer Support is a space where you can feel safe, supported, and empowered to tell your story and discuss your issues. SHARE peer volunt"
Arthritis Action,Arthritis,7714.0,"Arthritis Action is a UK charity that promotes a self-management approach to managing all types of arthritis which encompasses diet, nutrition, weight"
COPD Friends,Pulmonary disease,3676.0,"We are peer support community for people living with  COPD. Join us to share your story and experiences, ask questions and support others. Connect wit"
Living with Anxiety,Anxiety,5796.0,Welcome to Living with Anxiety a support group for people who are suffering with anxiety & similar related mental health problems. We offer a friendly
Oesophageal & Gastric Cancer,Gastric cancer,6264.0,"For more than three decades, the OPA has fought against oesophageal and gastric cancers, raising awareness, supporting patients, caregivers and their "
The Ehlers-Danlos Support UK,Ehlers-Danlos,3027.0,"The Ehlers-Danlos Support UK (EDS UK) was set up in 1987 to support, advise and inform those living with the Ehlers-Danlos syndromes and hypermobility"
Talk ED (eating disorders),Eating disord.,3582.0,"Talk ED (previously ABC) is a national UK eating disorders organisation with over 25 years of experience. We provide on-going care, emotional support "
My EXI Community,Physical activity,1503.0,"The EXI Community is here to support you on your physical activity journey. If you have questions, ideas or worries, please share them here. EXI has e"
British Pregnancy Advisory Service,Pregnancy,5218.0,"bpas, British Pregnancy Advisory Service, is a health charity providing care for thousands of women every year. Our Health Unlocked site is an online "
Neuro Support,Neurological conditions,2131.0,"Welcome to the Neuro Support Community. This community exists to improve the quality of life of people affected by any neurological condition, includi"
No Smoking Day,Quit smoking,5271.0,"The 'No Smoking Day' community inspires and helps smokers who want to quit, and is supported by an alliance of UK health bodies and charities. One in "
My Breast Cancer Community,Breast cancer,3933.0,"Welcome to My Breast Cancer Community. Here you can safely talk to other people affected by breast cancer – whether you are going through treatment, h"
Osteoporosis Support,Osteoporosis,4810.0,"A US based peer support community engaging, educating, and empowering people to build and keep strong bones for a long and independent life. Offering "
Australian Pain Management Association,Pain management,348.0,"APMA is a health promotion charity providing advocacy, information and practical support for people living with persistent (chronic) pain and their fa"
Epilepsy New Zealand,Epilepsy,88.0,We support those throughout New Zealand living with epilepsy.
"Foggy's ""Invisible Illness"" Support",Foggys Invisible Illness,5683.0,"With charitable donations, we are able to provide 2 Hydrotherapy sessions per week, for our paid members.We are dedicated to providing support, raisin"
Andover Fibromyalgia & ME Community Group,Fibromyalgia,2809.0,Welcome to AFMCG community!  Here you can share your experiences about living with Fibromyalgia & M.E in a non-judgemental friendly environment. AFMCG
Weight training community,Weight,905.0,"The weight training community is about encouraging each other to lift, learning from one another about how to do it better, and recording progress alo"
Epilepsy Action,Epilepsy,3164.0,Epilepsy Action is a peer support community run by the Epilepsy Action charity. We are a community of committed and supportive individuals excited to 
LSN,Lymphoedema,5817.0,Welcome to the Lymphoedema Support Network community. The LSN is a registered charity run by people who live with lymphoedema. Lymphoedema is a build 
Macular Society,Macular,5364.0,"Macular disease is the biggest cause of sight loss in the UK, with around 300 people diagnosed every day.The Macular Society is the only charity in th"
Ataxia UK,Ataxia,4126.0,Ataxia UK is the national charity for people affected by ataxia. Membership is free and open to anyone affected by the condition. We fund research int
NCHPAD Mobility Limitations,Physical activity & disability,18.0,"Founded in 1999, the National Center on Health, Physical Activity and Disability (NCHPAD) is a public health resource center on health promotion for p"
Drink Free,Quit drinking,1704.0,Welcome to the Drink Free community! This is a space for everyone to discuss their drink free journeys and get support from others who understand. Whe
Ask Norfolk Parents,Ask norfolk parents,950.0,"Welcome to the Ask Norfolk Parents community. This is a safe and supportive place for families of children and young people to share experiences, find"
Young Adult Stress Support,Young adult stress,264.0,Young Adult Stress Support is a community dedicated to providing reliable information and support to its members.
South West Wales Neurological Alliance,Neurological conditions,308.0,"We are community that supports individuals, groups and organisations that represent Neurological Conditions and those associated with their care; in N"
Migraine Support,Migraine,3595.0,"We are a peer support community for people living with migraines. Here we share our experiences, ask questions and support each other!"
JIA-at-NRAS,Arthritis,407.0,"This community is for anyone affected by the condition, Juvenile Idiopathic Arthritis (JIA). It  is run by the National Rheumatoid Arthritis Society ("
Low-Carb High-Fat (LCHF),Low-carb high-fat diet,2845.0,"This is a community about Low-carb High-Fat (LCHF) diet. A place for sharing experiences, asking questions and learning with others."
LUpus Patients Understanding and Support,Lupus,3487.0,"Lupus Patients Understanding &amp; Support (LUPUS) is a non-profit organisation for patients-affected-by-systemic lupus erythematosus, lupus variant c"
CLL Ireland,Chronic lymphocytic leukemia,,CLL Ireland is a community dedicated to providing reliable information and support to its members
Kidney Transplant Patient Support,Kidney transplant,1347.0,Welcome to our community! We are a group of people all affected by kidney transplants looking to share information and support.
Nutrition and Yoga for Health,Nutrition and yoga,1451.0,"Holistic health pioneer, yoga teacher and author, Ciara Jean Robert brings you this community.  Her wish is to share with you helpful tools on your ow"
Young Adults with Melanoma,Young adults melanoma,435.0,"Welcome to the Young Adults with Melanoma community, a place where you can access peer to peer support from others affected by melanoma."
Living with Fatty Liver and NASH,Fatty liver,8361.0,Living with Fatty Liver or NASH is a community of the Fatty Liver Foundation dedicated to supporting individuals who have been diagnosed or are at-ris
Melanoma Caregivers,Melanoma caregivers,291.0,"Welcome to the Melanoma Caregiver community, a place where you can access peer to peer support. We are the partners, parents, children and other loved"
MY SKIN,Skin conditions,8806.0,"Welcome to the MY SKIN Community, a peer support community for those experiencing issues with their skin. Join us to share your story and experiences,"
Crohn's & Colitis,Crohn's & colitis,44.0,Welcome to our online community and get the support you need in managing your condition. We know living with Crohn’s disease or ulcerative colitis can
HIV Partners,HIV partners,2341.0,Forum Link has joined forces with the HealthUnlocked team to create this HIV positive online community. We want to make it easier for HIV positive peo
PNI ORG UK,Postnatal illness,1083.0,A community for people affected by Post-Natal Illness looking for support and information. It is run by PNI ORG UK and exists to help people sufferers
Gluten Free Guerrillas,Gluten sensitivities,10899.0,Gluten Free Guerrillas is a group dedicated to supporting people with Coeliac Disease or Gluten sensitivities. Share your experiences about diagnosis 
NHS England: A Call to Action,National health service,,"NHS England is calling on patients, the public and staff to join in a discussion about the future of the NHS, so it can plan how best to deliver servi"
Aspergillosis and Rare Fungal Infection Support,Rare fungal infection,3897.0,Serious fungal infections are very rare but also very under-diagnosed and that has several consequences.1) There are many more cases than we currently
Myeloma UK,Myeloma,325.0,"The aim of this community is to provide a supportive, informative and friendly community for people affected by myeloma.Myeloma UK is the only organis"
Charcot-Marie-Tooth UK,Hereditary neuropathy,1690.0,CMTUK  provides support for people with Charcot-Marie-Tooth  disease(CMT) and  Hereditary Neuropathy with Pressure Palsy (HNPP).Our helpline is manned
Liver,Liver health,2038.0,Liver4Life is run by a few individuals passionate about liver health. We all have extensive backgrounds of working in the health and charity sector an
Mindful Emotion Coaching,Mindful emotion coaching,149.0,Mindful Emotion Coaching is a community dedicated to providing reliable information and support to its members.
Alopecia UK,Alopecia,1509.0,"Alopecia UK is a small national charity working to improve the lives of those affected by alopecia through aims of support, awareness, research and fu"
Multiple System Atrophy Trust,Multiple system atrophy,1850.0,The Multiple System Atrophy Trust is the only charity in the UK and Ireland that provides information and support to people affected by Multiple Syste
Prostate Cancer Under,Prostate cancer,369.0,Welcome   Men who were diagnosed before their 60th birthday and all those who love us.   Please use this group to discuss things you might not feel co
Encephalitis International,Encephalitis,705.0,"Who are we?We are Encephalitis International - a community dedicated to providing information and support to people worldwide, raising awareness and h"
Myasthenia Gravis Association,Myasthenia,429.0,"We are an online support community for people with myasthenia and their families. Join us to share your experience, ask questions and support one anot"
EDMESH,Chronic fatigue syndr.,2049.0,We are a charity primarily focused on helping patients and their families with ME (Myalgic Encephalomyelitis) and CFS (Chronic Fatigue Syndrome) livin
Memory Health: Alzheimer's Support Group,Alzheimer's,1359.0,"Welcome to MyBrainTest Health, a social community dedicated to providing evidence based information on memory loss causes, and early stage Alzheimer's"
FND Action,Neurological disord.,706.0,"History has created a lot of misconception of Functional Neurological Disorders which has led to poor treatment and care of those diagnosed, which inc"
Autism Support,Autism,3783.0,"This Autism Support Community is an online peer to peer support network of people affected by autism. If you, or someone you love, is living with auti"
Colon Cancer Connected,Colon cancer,14721.0,Welcome to the Global Colon Cancer Association's HealthUnlocked Community! HealthUnlocked is a social network for health. By finding others with simil
Fight MPN, Myeloproliferative neoplasms,849.0,"Welcome to the Fight MPN community! This is a safe space for anyone affected by myeloproliferative neoplasms (MPN) to find support, share advice and m"
PBCers Organization,Primary bil. cholangitis,1494.0,PBCers Organization is a community dedicated to providing reliable primary biliary cholangitis (PBC) information and offer support to its members. Top
OvaCare,Ovarian cancer,2059.0,We are a charity that aims to improve the diagnosis and education of ovarian cancer within Ireland.
Healthy Evidence,Medicine news,3071.0,"Every month there are dozens of news reports about medical breakthroughs, health scares and wonder drugs. The Healthy Evidence community is a place fo"
ITP Support Association,Immune thrombocytopenia,4157.0,Registered UK charity supporting sufferers of the auto immune bleeding disorder Immune Thrombocytopenia. Views expressed are those of individuals & no
Couch to Buddha,Meditation,343.0,"Welcome to couchtobuddha, a community where you can learn and connect with others interested in meditation."
Meningitis Now,Meningitis,6925.0,"Meningitis can strike in an instant, but the impact can last a lifetime. At Meningitis Now we offer support to anyone living in the UK who has been af"
Lipoedema UK,Lipoedema,889.0,"We are a community dedicated to supporting those with Lipoedema, which is an inherited disease that makes you accumulate fat below the waist, often gi"
SWEDA,Eating disord.,627.0,"Having an eating disorder, or supporting someone who has, can be a distressing and bewildering experience. Somerset and Wessex Eating Disorders Associ"
MyDirectives: Make your medical wishes known!,MyDirectives app,70.0,"MyDirectives is the first completely digital emergency, critical and advance care planning service that is secure, easy to understand, and free to con"
Pelvic Radiation Disease Association,Pelvic radiation disease,743.0,The PRDA community is a peer support group where people can ask questions and share their experiences as well as supporting each other in living with 
Weight Loss Surgery Info,Weight loss surgery,1139.0,WLSinfo is a registered charity (no 1103151) set up and run entirely by volunteers and maintained by donations from members.Aims and Objectives of the
Pancreatic Cancer Action,Pancreatic cancer,1789.0,"Pancreatic Cancer Action aims to support those impacted by pancreatic cancer. We do this by increasing awareness, influencing government policy and pr"
My Cancer Community,Cancer,1716.0,"Welcome to My Cancer Community. This is a safe space to connect with others who’ve been impacted by cancer. Whether you are going through treatment, h"
Cure Arthritis Community,Arthritis,2848.0,"We’re a US-based non-profit searching for a cure to help an estimated 50 million Americans and 300,000 children afflicted with various forms of arthri"
Sexual Health Matters,Sexual health,,This is a community hoping to bring together thoughts are queries from people concerned about their sexual health. Promoting safe and happy sexual pra
Adult Acne Support,Adult acne,1158.0,"Welcome to the Adult Acne Support community! This community is for people who are experiencing acne in adulthood to discuss treatments, share experien"
Skin Cancer UK,Skin cancer,468.0,WE ARE SKCIN.·  The UK’s national melanoma and skin cancer charity dedicated to raising awareness through education to promote the prevention and earl
Diabetes & Hypertension Help Society,Diabetes & hypertension,10922.0,"The diabetes and hypertension community is your place to ask questions, get answers and support others impacted by the condition. It is open to everyo"
Canadian Organization for Rare Disorders,Rare disord.,201.0,CORD is Canada's national network for organizations representing all those with rare disorders. CORD provides a strong common voice to advocate for he
Asperger's Support,Asperger's,1617.0,Asperger's Support is a community dedicated to providing a safe space for those suffering from Asperger's to connect and receive support from others i
Epilepsy Research Institute,Epilepsy,2353.0,Epilepsy Research UK is the only national organisation exclusively dedicated to funding research into all areas of epilepsy.  Epilepsy can be a very d
Epilepsy Society,Epilepsy,900.0,We are a community dedicated to supporting people affected by epilepsy and seizures.
Living Well with HIV,HIV,1023.0,"This community is for people affected by HIV/ AIDS. If you or someone you know is positive, this is a safe peer support community is for you."
Acoustic Neuroma Support,Acoustic neuroma,2769.0,"Welcome to The Brain Tumour Charity Acoustic Neuroma peer support online community for those affected by Acoustic Neuroma (Vestibular Schwannoma), a r"
TB Alert,Tuberculosis,1089.0,We are community dedicated to supporting patients and families impacted by tuberculosis (TB).
Bladder Health UK,Bladder health,1268.0,"The Bladder Health UK Foundation gives support to people with all forms of cystitis, overactive bladder and continence issues together with their fami"
FASD Support,Foetal alcohol spectr. dis.,957.0,"Foetal Alcohol Spectrum Disorders (FASD) Support is an online community dedicated to providing a safe space for all people, families and communities a"
LDN Research Trust,Naltrexone,1443.0,"The primary aim of the Trust is to initiate Clinical Trials of Low Dose Naltrexone.   Whilst working to raise funds for trials, we have helped over 16"
Eczema Association of Australasia Inc,Eczema,441.0,"We support and educate Eczema sufferers and carers, along with the wider community, in all aspects of Eczema and its impact in Australia and New Zeala"
Non Hodgkin's Lymphoma Friends,Non hodgkin's lymphoma,1811.0,"Patient Empowerment Network (PEN) is honored to offer a peer-support community for those living with Non-Hodgkin's Lymphoma, their families and their "
OCD Support,Obsess. compuls. disord.,,This community has been archived. Please use the Search function to find other relevant communities on the platform: healthunlocked.com/search
Fibro Friends WSM,Fibromyalgia,1106.0,"Fibro Friends WSM is registered with the Fibroduck Foundation Our aim is to reach out to others in the area with Fibromyalgia, Chronic Fatigue and Sim"
Living with Lyme Disease UK,Lyme disease ,256.0,Welcome to LWLD community!  Here you can share your experiences about living with Lyme Disease in a non-judgemental friendly environment. The philosop
Tourettes Action,Tourette syndr.,1284.0,"This group connects people, volunteers and professionals involved with Tourettes for support and help online."
AMN EASIER,Adrenomyeloneuropathy,1326.0,AMN Easier was set up to help men and women who have adrenomyeloneuropathy (AMN) -  to help make this disease a bit easier to live with.AMN EASIER pro
Blue Faery Liver Cancer,Liver cancer,703.0,"Blue Faery’s mission is to prevent, treat and cure primary liver cancer, specifically Hepatocellular Carcinoma (HCC), through research, education and "
Action on Pain,Chronic pain,1921.0,"Action on Pain is a national charity established in 1998 by Ian Semmons, our Chairman, as a result of his own frustration that it took so long to get "
Continence Support,Continence,672.0,"Welcome to the Continence Support Community on HealthUnlocked, a dedicated space for individuals experiencing incontinence to find support, share expe"
SHARE Uterine Cancer Support,Uterine cancer,356.0,"SHARE Uterine Cancer Support is a space where you can feel safe, supported, and empowered to tell your story and discuss your experiences with uterine"
Understanding Clinical Trials,Clinical trials,1327.0,This community is dedicated to engaging the public and patients as partners in the clinical research process. It is run by The Center for Information 
Group B Strep Support,Group B strep,757.0,"This is a community dedicated to helping those affected by group B Strep (GBS). GBS is a common bacterium that lives in 20-30% of adults, usually with"
Circulation Foundation,Circulation,609.0,"We are an online peer support community for everyone affected by circulatory disorders. Join us to share your experience, ask questions and support on"
Cervical Myelopathy,Cervical myelopathy,639.0,Cervical Myelopathy is caused by deterioration in the spine in the neck leading to compression of the spinal cord and symptoms such as “numb” and “clu
Vegan Foods for Life,Vegan foods,998.0,Vegan Foods for Life is a community for vegans and those interested in learning more about the vegan diet to chat and support each other. Feel free to
Different Strokes,Stroke survivors,1329.0,"We are a peer support community for working age stroke survivors. Here we share our stories, ask questions and support each other. Join us to tell you"
Paget’s Support,Paget’s diseas,302.0,"This is a safe online community for anyone affected by Paget's disease to share advice, find support and meet others who truly understand.Whether you'"
Sickle Cell Society,Sickle cell disord.,2019.0,"The Sickle Cell Society is Britain’s only national charity for sickle cell disorders, an inherited haemoglobin disorder. The Sickle Cell Society was f"
Living with Sickle Cell Disease,Sickle cell diseas,496.0,Living with Sickle Cell Disease is a community dedicated to supporting individuals affected by sickle cell disease; whether you've been diagnosed with
PKD Charity for Autosomal Dominant PKD,Kidney disease,1173.0,We are a community dedicated to supporting individuals and families affected by Autosomal Dominant Polycystic Kidney Disease or ADPKD.The PKD Charity 
Myositis UK,Myositis,1370.0,"Myositis UK is a community providing information and support to individuals and their families affected by Dermatomyositis, Polymyositis, Inclusion Bo"
LGBT Cancer Community,LGBT cancer,219.0,"A friendly, safe, informal atmosphere where we can pick each other's brains.   Talking about cancer in our community is a powerful tool. Our community"
Sports Injury,Sports injury,253.0,"A community dedicated to supporting people who want to get back to sport, improve performance and encourage others to have a go!"
Chronic Pancreatitis Support,Chronic pancreatitis,1065.0,"Welcome to the Chronic Pancreatitis Support community, here to support anyone impacted by chronic pancreatitis and related conditions, such as EPI (Ex"
Baby and Us,Pregnancy & parenting,2072.0,We are a peer support community for parents! Here we share experiences and support each other through the journey of pregnancy and parenting. Join to 
Not Defined By Endometriosis,Endometriosis,470.0,"We are a peer-support group providing support to fellow endometriosis warriors and advocating and fighting for better research, funding and an eventua"
Graduates of GGC PMP,Pain management,54.0,"Welcome to the online community forum for graduates of the Greater Glasgow & Clyde Pain Management Programme (PMP), in partnership with Pain Concern c"
Borders Pain Management,Pain management,178.0,We are a peer support group specifically for individuals affected by Chronic Pain within the Scottish Borders. We offer support and advice to those di
SNRPMP Graduates Group,Pain management,34.0,"Welcome to the online community forum for graduates of the NHS Scottish National Residential Pain Management Programme (PMP), in partnership with Pain"
"Fertility, Miscarriage & IVF Support",Fertility & miscarriage,3789.0,"The Fertility, miscarriage and IVF Support community is run by HealthUnlocked and is an online peer-to-peer support network for people affected by any"
Infertility Support,Infertility,1536.0,Infertility Support  is a community dedicated to providing reliable information and support to its members.
Living with Interstitial Lung Disease (ILD),Interstitial lung disease,157.0,The CHEST Foundation is the patient-focused philanthropic arm for the American College of Chest Physicians. Our mission is to champion lung health by 
Gender Identity,Gender identity,160.0,"Hello, and welcome to Gender Identity!The Gender Identity community is here to provide help and support for people living with Gender Identity issues "
Allergic to Glycols,Allergic to glycols,217.0,"This is a support community for people learning to live with allergies to glycol compounds: Polyethylene glycol (PEG, PPG), propylene glycol (PG), eth"
BWS Support, Beckwith-Wiedemann syndr.,715.0,"A community dedicated to supporting those with Beckwith-Wiedemann Syndrome (BWS), which is an overgrowth disorder."
The Dyslexia Community,Dyslexia,2344.0,"The Dyslexia Community is a peer support community for all those affected by dyslexia to discuss, share tips and find support. Why not introduce yours"
Survivors of Childhood Brain Tumours,Childhood brain tumours,102.0,"Welcome to the Survivors of Childhood Brain Tumour Community Group, established by Success Charity. Success Charity is committed to enabling brighter "
Stanmore Young Spine Group,Othopaedic hospital,210.0,"The Royal National Orthopaedic Hospital NHS Trust (RNOH) is the largest orthopaedic hospital in the UK, and is regarded as a leader in the field of or"
Sweet's Syndrome UK,Sweet's syndr.,489.0,Sweet's Syndrome UK is a Derbyshire-based (formerly Cardiff-based) patient group that helps those with the rare autoinflammatory condition and neutrop
SarcoidosisUK,Sarcoidosis,447.0,"We are an online support community for people who experience Sarcoidosis. Join today and get support, help others, and discuss your personal experienc"
Lynch Syndrome UK,Lynch syndr.,119.0,Lynch syndrome (LS) is a genetic disorder that causes an increase in certain cancers at an earlier age than usual. There about 12 cancers that can be 
Gynae Cancer Support,Gynecologic cancer,1686.0,"The Gynae Cancer Support Community is an online safe space for people impacted by gynecologic cancer  (including cervical, ovarian, uterine, vaginal, "
Chronic Myofascial Pain,Chronic pain,509.0,We have set up this community in order to provide support for anyone suffering from Chronic Myofascial Pain (CMP); to provide and share information ab
LIVErNORTH,Liver health,439.0,"We are a adult liver patient support group based at the Freeman Hospital in Newcastle upon Tyne, England. Whatever kind of liver disease you may have,"
DC Action,Dyskeratosis congenita ,30.0,"We are a peer support group for people and families affected by telomeropathies and dyskeratosis congenita (DC). DC Action aims to improve diagnosis, "
The UK Mastocytosis Support Group,Mastocytosis,635.0,The UK Mastocytosis Support Group community is for anyone with diagnosed or un-diagnosed Mast Cell Diseases or those supporting them.The UK Mastocytos
SHARE Ovarian Cancer Support,Ovarian cancer,2827.0,"SHARE Ovarian Cancer Support is a space where you can feel safe, supported, and empowered to tell your story and discuss your issues. SHARE peer volun"
