comm_name,short,members_count,about_comm
Nutriri Mindful Eating,Mindful eating,777.0,This group mostly congregates on our non-profit Co-Learning Hub... a trusted space to connect just as we are; no right or wrong way to show up and par
Hearing Link,Hearing loss,622.0,"Hearing Link is a peer support community for people with hearing loss.  Join to ask questions, share experiences and connect with others who have pers"
Cloudy with a Chance of Pain,Arthritis,1540.0,A community for people with chronic pain or arthritis. Cloudy with a Chance of Pain is a UK smartphone study and citizen science experiment studying t
Cancer Journeys Foundation,Cancer,396.0,"The Cancer Journeys Foundation is a registered non-Profit Charity with the mission of providing cancer survivors and their supporters information, too"
Fasting and Furious,Fasting,1197.0,"Fasting and Furious is a community to chat about fasting and support others who know what hanger feels like! This includes, but isn't limited to: inte"
Diabetes South Africa,Diabetes,523.0,"Diabetes South Africa is a non-profit organization, founded in 1969 to be a support and an advocate for all people with diabetes in South Africa."
deafPLUS,Hearing & visually impaired,682.0,"We are an online community supporting  deaf, hard of hearing, visually impaired and older persons. Join us to share your experiences, discuss day-to-d"
C,Kidney health,299.0,Welcome to the National Kidney Foundation's C3G Community! Our goal is to be the definitive forum and database serving the needs of people living with
Living with a Stoma,Living with a stoma,1038.0,We are a peer support community for people who experienced stoma or are affected by stoma surgery on their bowel or bladder. Join us to discuss your c
EFA,Allergy & airways diseases,2095.0,European Federation of Allergy and Airways Diseases Patients’ Associations. We are a community dedicated to supporting those impacted by allergy and a
National Tremor Foundation,Tremor,,"The National Tremor Foundation (or NTF as we are known) is an organisation where we aim to provide help, support and advice to all those living with a"
Hunts Community Cancer Network,Cancer,110.0,"Hunts Community Cancer Network welcomes you to this site which is designed to support people recovering from, living with or experiencing the late eff"
HealthWeb Navigator,Healthweb navigator,236.0,"The goal of this community is to help patients to find the best resources about the health care. At HealthWeb Navigator, we evaluate healthcare websit"
Cook For Your Life,Cancer,657.0,"Cook for Your LIFE is a nonprofit organization whose mission is to improve the health of people touched by cancer. We give practical knowledge, tools,"
The Australian Sjögren's Syndrome Association,Sjögren's syndr.,2473.0,"The Australian Sjogren's Syndrome Association Inc. was incorporated in Parramatta in 2001, although due to illness of the founder, the association did"
World According to Lupus,Lupus,652.0,World According to Lupus is a community dedicated to providing reliable information and support to its members
FieryBones - RA Community,Arthritis,748.0,"Rheumatoid Arthritis, or RA, is a type of auto-immune disease where the body's immune system starts attacking its own tissues and joints. It can happe"
Down's Syndrome Support,Down's syndr.,325.0,We are a friendly support community for people living with or caring for someone with Down's syndrome. Join to connect with others who understand!Why 
Society for Women's Health Research,Women's health,178.0,Society for Women's Health Research is a community dedicated to providing reliable information and support to its members
Lymphoma Canada,Lymphoma,782.0,"Lymphoma affects many people, from patients, family and caregivers, to medical professionals and researchers. Lymphoma Canada connects and empowers th"
Stand Up,Chronic pain,,"Welcome to the START MOVING community. This is a place  where everyone with joint pain can give and get person-to-person support, and especially for w"
Cancer Support Scotland,Cancer,237.0,Cancer Support Scotland is here to provide emotional and practical support on a one-to-one basis and through community-based groups to anyone affected
Facial Palsy UK,Facial palsy,1175.0,"Facial Palsy UK exists to ensure that every person in the UK affected by facial palsy is given access to the best information, treatment and support a"
Living Positively with Cerebral Palsy,Cerebral palsy,464.0,I have Cerebral Palsy. I have had it since birth. I'm adult now.    What I have found is that there is a lot of information out there for parents who 
HFI Connect - Hepatitis,Hepatitis,965.0,"We are a peer support community for people affected by hepatitis. It is run by The Hepatitis Foundation International (HFI), a non-profit organization"
Hepatitis C Support,Hepatitis C,685.0,We are a friendly support community for people living with hepatitis C. Join to connect with others who understand!Why not share your story today: hea
MS Society,Multiple sclerosis,641.0,"We're the MS Society, we're a community of people living with or affected by MS.Whether you have MS, or care about someone who does, our community is "
Fight Bladder Cancer,Bladder cancer,1214.0,"Fight Bladder Cancer is a national charity supporting those with bladder cancer, campaigning to raise awareness and supporting medical research."
Adenomyosis Advice Association,Adenomyosis,863.0,"The Adenomyosis Advice Association founded in 2011 is headquartered in the United Kingdom.  It is an organisation that offers advice, support and info"
Unsalted Heart,Heart health,557.0,"Being heart healthy is more than just watching Saturated and Trans fats. If you have too much sodium/salt in your diet, it can continue to put you at "
OPA Palliative Care & Guidance,Palliative care,,"The Oesophageal Patients Association (OPA) aims to support those who have undergone, or may undergo, surgery and other treatments for oesophageal and "
PACEMAKERusers,Pacemaker users,47.0,PACEMAKERusers is a community dedicated to providing reliable information and support to its members.
Pseudomyxoma Survivor,Pseudomyxoma,117.0,"If you’ve found the Pseudomyxoma Survivor community, chances are you’ve been affected in some way by pseudomyxoma peritonei (PMP), appendix cancer or "
Mamafit,Mamafit,311.0,"Mamafit® is an award winning and leading health, fitness and wellbeing programme for pregnant women, mums and families. The Mamafit community is a pla"
Breast Cancer India,Breast cancer,3231.0,"Breast Cancer India is a non profit website, managed by professionals in the field of breast cancer, with an aim of disseminating correct and proper i"
Healthy Happy Woman,Healthy happy woman,2040.0,Back in 1997 I started an organisation called the Hysterectomy Association. 22 years later it closed and all the information moved to a new website ca
Kidney Health New Zealand,Kidney health,431.0,We support patients and their families living in New Zealand who have been impacted by kidney disease.
Hepatitis C Trust,Hepatitis C,751.0,The Hepatitis C Trust is the UK charity for hepatitis C. We support and advocate for people who have hepatitis C and who have had it in the past.Most 
Children With Cerebral Palsy,Children cerebral palsy,,"ere case, we are always here to support every one of them. Children with Cerebral Palsy is a campaign across the UK and South Korea to support and rai"
St Thomas Lupus Trust,Lupus,1396.0,"The St. Thomas Lupus Trust was set up as a registered charity in 1991. Its aim was, and still is, to fund 100% of the vital lupus research at St. Thom"
American Cancer Survivors,Cancer,492.0,"We are a peer support community for Americans who are fighting or have survived cancer. Here we share our stories, experiences, ask questions and supp"
Radiotherapy Cancer Treatment,Radiotherapy cancer,217.0,We are an online community for people who have experienced radiotherapy. Share your experiences and support one another through treatment and beyond!
Lupus Foundation of Florida,Lupus,783.0,"The Lupus Foundation of Florida provides support, education, referrals, advocacy and hope to those affected by lupus."
Quit,Quit smoking,852.0,"Quit4Life helps people living or working in HAMPSHIRE, UK, who want to stop smoking, are thinking of stopping smoking, or who have quit and want to st"
Finding a Living Donor: From Home,Finding a donor,23.0,Finding a Living Donor: From Home is a community dedicated to providing reliable information and support to its members.
Cavernoma Alliance UK,Cavernoma,441.0,"We are a community that supports those affected by cavernoma, otherwise known as cerebral cavernous malformations or cavernous angioma. What is a cave"
PCD Family Support Group (UK),Prim. ciliary dyskinesia,624.0,This volunteer-run group supports patients and families affected by Primary Ciliary Dyskinesia (PCD) in the UK. Any advice given is from a personal pe
FPA Contraception,Contraception,480.0,"We’re a sexual health charity. We give straightforward information and support on sexual health, sex and relationships . We aren't currently able to a"
OPA Caregivers,Oesophageal & gastric cancer,26.0,"For more than three decades, the OPA has fought against oesophageal and gastric cancers, raising awareness, supporting patients, caregivers and their "
Barrett's Oesophagus,Barrett's oesophagus,6.0,Barrett's Oesophagus is a community dedicated to providing reliable information and support to its members.
Partners for Behcet's,Partners for Behcet's,537.0,"We are a community dedicated to supporting those with Behcet’s Syndrome, which is a rare disease that sees the blood vessels become inflamed."
Leukodystrophy Support,Leukodystrophy,,"Welcome to Leukodystrophy Support, an online support community for anyone that is affected, directly or indirectly, by a leukodystrophy.This community"
Womb Cancer Support UK,Womb cancer,265.0,Womb Cancer Support UK was set up in April 2011 by womb cancer survivor Kaz Molloy. We offer support and information to women who have been diagnosed 
Melanoma Wellness Canada,Melanoma,92.0,Melanoma Wellness Canada is a group created and maintained by the Canadian melanoma patient group Save Your Skin Foundation. It exists as a place for 
Myeloma America Support,Myeloma,1239.0,"Welcome to the Myeloma America Support community! This is a safe space for anyone affected by myeloma to find support, share advice and meet others wh"
